,job_title,company_name,country,city,job_type,work_location,experience_level,yrs_exp,industry_and_skills
883,Technical Service Engineer (Field),Eastman,UnitedArabEmirates,Dubai,Full Time,Not Specified,Entry Level,Not Specified,"Engineering - Construction/Civil/Architecture, Engineering - Telecom/Technology, Engineering - Mechanical/Electrical, Engineering, AutoCAD, Information Technology (IT), Technical Office, Computer Science, Technical Support, Customer Service"
884,Learning & Development Manager- Hospitality,The First Group,UnitedArabEmirates,Dubai,Full Time,Not Specified,Experienced,Not Specified,"IT/Software Development, Engineering - Telecom/Technology, Education/Teaching, Education, Learning, Training, Information Technology (IT), Computer Science, Teaching, E-Learning"
885,Senior Outsystem Engineer,Adree,Egypt,Cairo,Full Time,Not Specified,Not specified,Not Specified,"IT/Software Development, Engineering - Telecom/Technology, Engineering - Mechanical/Electrical, Engineering, Information Technology (IT), Computer Science, Software Engineering, Software Development, Computer Engineering, Mechanical Engineering"
886,Process Engineer - Sulfur Recovery Sour Water Stripper,ICM People do Brasil,SaudiArabia,Riyadh,Full Time,Not Specified,Entry Level,Not Specified,"IT/Software Development, Engineering - Telecom/Technology, Engineering - Mechanical/Electrical, Engineering, Computer Science, Information Technology (IT), Mechanical Engineering, Production, Software Engineering, Software Development"
887,Frontend Developer - Jeddah,Lucidya LLC.,SaudiArabia,Jeddah,Full Time,Not Specified,Not specified,Not Specified,"Creative/Design/Art, IT/Software Development, Engineering - Telecom/Technology, Information Technology (IT), Computer Science, Software Development, javaScript, CSS, Front-End, HTML"
888,Monitoring and Evaluation Specialist – Egypt – USAID Teacher Excellence Initiative Activity,EDC (Education Development Center),Egypt,Cairo,Full Time,Not Specified,Experienced,Not Specified,"Marketing/PR/Advertising, Project/Program Management, Education/Teaching, microsoft office, marketing, project management, education, management, teaching, english"
889,Fullstack Developer - Django & React,TalPods,Egypt,Cairo,Full Time,Not Specified,Experienced,Not Specified,"Creative/Design/Art, IT/Software Development, Engineering - Telecom/Technology, Information Technology (IT), Computer Science, Software Development, javaScript, HTML, Software Engineering, CSS"
890,dss+ - Sustainability Consultant,dss+,UnitedArabEmirates,Dubai,Full Time,Not Specified,Experienced,Not Specified,"IT/Software Development, Analyst/Research, Engineering - Telecom/Technology, Information Technology (IT), DSS, Computer Science, PCI, Information Security, NIST, Engineering"
891,"Account Manager, Partnerships",160over90,UnitedArabEmirates,Dubai,Full Time,Not Specified,Entry Level,Not Specified,"Customer Service/Support, Marketing/PR/Advertising, Sales/Retail, Sales, Sales Skills, Customer Service, Sales Target, Customer Support, Customer Care, Account Management"
892,Operations Support Event management National Consultant,United Nations Population Fund (UNFPA),Egypt,Cairo,Freelance / Project,Not Specified,Experienced,Not Specified,"IT/Software Development, Sales/Retail, Engineering - Telecom/Technology, sales, information technology (it), sales skills, computer science, administration, management, operations"
893,Front-End Developer,Jadeer,Egypt,Cairo,Full Time,Not Specified,Entry Level,Not Specified,"Creative/Design/Art, IT/Software Development, Engineering - Telecom/Technology, Information Technology (IT), Computer Science, Software Development, javaScript, CSS, HTML, Software Engineering"
894,Security - CCTV Operator,Sofitel Marrakech,UnitedArabEmirates,Ras al-Khaimah,Full Time,Not Specified,Entry Level,Not Specified,"Installation/Maintenance/Repair, IT/Software Development, Engineering - Telecom/Technology, Information Technology (IT), Computer Science, Security, Engineering, Computer Engineering, Networking, Software Engineering"
895,Senior CRM Specialist,Adree,Egypt,Cairo,Full Time,Not Specified,Not specified,Not Specified,"Human Resources, Marketing/PR/Advertising, Media/Journalism/Publishing, Marketing, Social Media, Human Resources (HR), E-marketing, Microsoft Office, Digital Marketing, Media"
896,Test Analyst - SAP Systems (Arabic speakers preferred),Trans Skills LLC,UnitedArabEmirates,Dubai,Full Time,Not Specified,Entry Level,Not Specified,"IT/Software Development, Analyst/Research, Engineering - Telecom/Technology, Information Technology (IT), Software Testing, Computer Science, Testing, Analyst, Software, Software Engineering"
897,Business Intelligence Team Lead,Jadeer,Egypt,Cairo,Full Time,Not Specified,Experienced,Not Specified,"IT/Software Development, Sales/Retail, Engineering - Telecom/Technology, sales, sales skills, information technology (it), computer science, engineering, management, project management"
898,F&B Area Manager,AWJ,UnitedArabEmirates,Dubai,Full Time,Not Specified,Experienced,Not Specified,"Hospitality/Hotels/Food Services, Sales/Retail, Engineering - Telecom/Technology, F&amp;B, Sales, Sales Skills, Information Technology (IT), Customer Service, Microsoft Office, Food &amp; Beverage"
899,Software Engineer - Backend (Jeddah),Lucidya LLC.,SaudiArabia,Jeddah,Full Time,Not Specified,Not specified,Not Specified,"IT/Software Development, Quality, Engineering - Telecom/Technology, Information Technology (IT), Computer Science, Software Development, Software Engineering, Engineering, Computer Engineering, Software"
900,Control and Reporting Lead (French Speaker),Pepsi,Egypt,Cairo,Full Time,Not Specified,Not specified,Not Specified,"IT/Software Development, Quality, Engineering - Telecom/Technology, Computer Science, Information Technology (IT), Startup, Testing, Automation, Engineering, Quality Control"
901,Team Leader - Operations,cartier,UnitedArabEmirates,Dubai,Full Time,Not Specified,Not specified,Not Specified,"IT/Software Development, Sales/Retail, Engineering - Telecom/Technology, Sales, Sales Skills, Information Technology (IT), Sales Target, Computer Science, Customer Service, Real Estate"
902,System Administrator - Jeddah,Lucidya LLC.,SaudiArabia,Jeddah,Full Time,Not Specified,Not specified,Not Specified,"Installation/Maintenance/Repair, IT/Software Development, Engineering - Telecom/Technology, Information Technology (IT), Computer Science, System Administration, Engineering, Linux, Installation, Computer Engineering"
903,Account Management Director - SaaS Products,Jadeer,Egypt,Cairo,Freelance / Project,Not Specified,Manager,Not Specified,"Customer Service/Support, Marketing/PR/Advertising, Sales/Retail, Sales, Sales Skills, Customer Service, Sales Target, Customer Support, Customer Care, Account Management"
904,Senior PPC Specialist,Future Group Translation Services,Egypt,Cairo,Full Time,Not Specified,Experienced,Not Specified,"Human Resources, Marketing/PR/Advertising, Media/Journalism/Publishing, Marketing, Social Media, Human Resources (HR), E-marketing, Microsoft Office, Digital Marketing, Media"
905,Sustainability Associate Manager,Pepsi,Egypt,Cairo,Full Time,Not Specified,Not specified,Not Specified,"IT/Software Development, Project/Program Management, Engineering - Telecom/Technology, Project Management, PMP, Information Technology (IT), Computer Science, Marketing, Engineering, Microsoft Office"
906,GPPRR Management Specialist,Beckman Coulter,SaudiArabia,Riyadh,Full Time,Not Specified,Not specified,Not Specified,"Customer Service/Support, Human Resources, Marketing/PR/Advertising, Customer Service, Marketing, Microsoft Office, Project Management, Human Resources (HR), Customer Support, English"
907,Partner Certification Leader,Orange,Egypt,Cairo,Full Time,Not Specified,Not specified,Not Specified,"IT/Software Development, Sales/Retail, Engineering - Telecom/Technology, information technology (it), computer science, engineering, sales, marketing, management, agile"
908,On-Site Service Machinist,GE Vernova,Egypt,Cairo,Full Time,Not Specified,Entry Level,Not Specified,"Installation/Maintenance/Repair, IT/Software Development, Engineering - Telecom/Technology, information technology (it), engineering, computer science, customer service, quality, site, service"
909,MLOps Engineer - LLM and GenAI Products,Merck Group,Egypt,Cairo,Full Time,Not Specified,Experienced,Not Specified,"IT/Software Development, Engineering - Telecom/Technology, ai, artificial intelligence, azure, c#, cloud, computer science, deployment, engineering"
910,Quality Assurance Specialist,Future Group Translation Services,Egypt,Cairo,Full Time,Not Specified,Entry Level,Not Specified,"IT/Software Development, Quality, Engineering - Telecom/Technology, Quality Assurance, Quality Control, Quality, QA, QC, Engineering, Science"
911,Project Engineer - Water & Wastewater,GSEC,Egypt,Cairo,Full Time,Not Specified,Not specified,Not Specified,"Engineering - Construction/Civil/Architecture, Project/Program Management, Engineering - Mechanical/Electrical, Project Management, Engineering, Civil Engineering, Construction, Information Technology (IT), Computer Science, Architecture"
912,Strategic Development Specialist,iHR (International Human Resources),SaudiArabia,Riyadh,Full Time,Not Specified,Experienced,Not Specified,"Business Development, Marketing/PR/Advertising, Sales/Retail, Business Development, Sales, Sales Skills, Sales Target, Marketing, Customer Service, Microsoft Office"
913,PMO Manager,Kinetic Business Solutions,SaudiArabia,Riyadh,Full Time,Not Specified,Entry Level,Not Specified,"IT/Software Development, Project/Program Management, Engineering - Telecom/Technology, Project Management, PMO, PMP, Information Technology (IT), Computer Science, Computer Engineering, Microsoft Office"
914,Senior Business Analyst,Tech Integrated Services,Egypt,Cairo,Full Time,Not Specified,Not specified,Not Specified,"IT/Software Development, Analyst/Research, Engineering - Telecom/Technology, Information Technology (IT), Business Analysis, Computer Science, Analysis, Business Development, Sales, Sales Skills"
915,Senior Backend Developer PHP / WordPress,Shahbandr,Egypt,Cairo,Full Time,Not Specified,Entry Level,Not Specified,"Creative/Design/Art, IT/Software Development, Engineering - Telecom/Technology, Information Technology (IT), PHP, Computer Science, Software Development, javaScript, Laravel, MySQL"
916,Head Full Stride Cloud,Wipro,UnitedArabEmirates,Dubai,Full Time,Not Specified,Not specified,Not Specified,"IT/Software Development, Engineering - Telecom/Technology, Engineering - Mechanical/Electrical, information technology (it), computer science, python, computer engineering, aws, html, agile"
917,Artificial Intelligence Engineer,iHR (International Human Resources),SaudiArabia,Riyadh,Full Time,Not Specified,Experienced,Not Specified,"IT/Software Development, Analyst/Research, Engineering - Telecom/Technology, Artificial Intelligence, Computer Science, Information Technology (IT), Software Engineering, Computer Engineering, Software Development, Engineering"
918,Project Manager,Lucidya,SaudiArabia,Riyadh,Full Time,Not Specified,Not specified,Not Specified,"Engineering - Construction/Civil/Architecture, IT/Software Development, Project/Program Management, Project Management, Engineering, Information Technology (IT), Management, Computer Science, Civil Engineering, Microsoft Office"
919,Platform Reliability Engineer,BHFT,UnitedArabEmirates,Dubai,Full Time,Not Specified,Not specified,Not Specified,"Installation/Maintenance/Repair, IT/Software Development, Engineering - Telecom/Technology, Engineering, Computer Science, Information Technology (IT), AWS, DevOps, Maintenance, B2B"
920,ERP Technical Support Consultant (Microsoft Dynamics 365) - KSA Based,Jadeer,SaudiArabia,Riyadh,Full Time,Not Specified,Experienced,Not Specified,"Customer Service/Support, IT/Software Development, Engineering - Telecom/Technology, Technical Support, Customer Support, Customer Service, ERP, Computer Science, Customer Care, Information Technology (IT)"
921,Senior Software Project Manager,Jadeer,Egypt,Cairo,Full Time,Not Specified,Experienced,Not Specified,"IT/Software Development, Project/Program Management, Engineering - Telecom/Technology, Project Management, Information Technology (IT), Computer Science, PMP, Software Development, Software, Software Engineering"
922,"DESIGN MANAGER - COMMERCIAL OFFICES, MUSEUM & EXHIBITION",Jobs for Humanity,SaudiArabia,Riyadh,Full Time,Not Specified,Not specified,Not Specified,"Engineering - Construction/Civil/Architecture, Creative/Design/Art, IT/Software Development, Design, Project Management, Engineering, Architecture, Management, Information Technology (IT), Marketing"
923,Sr. Executive ISM,Reliance Human Resources Consultancy,UnitedArabEmirates,Dubai,Full Time,Not Specified,Experienced,Not Specified,"IT/Software Development, Project/Program Management, Engineering - Telecom/Technology, information technology (it), computer science, engineering, microsoft office, quality, marine, qhse"
924,Production Supervisor (BOP Repair Services),Mazrui International,UnitedArabEmirates,Dubai,Full Time,Not Specified,Experienced,Not Specified,"Manufacturing/Production, Pharmaceutical, Engineering - Other, Production, Manufacturing, Engineering, Pharmacy, Science, Pharmaceutical, Quality"
925,Product Manager - Jumia (Full Time),Jumia Group,Egypt,Cairo,Full Time,Not Specified,Entry Level,Not Specified,"IT/Software Development, Marketing/PR/Advertising, Sales/Retail, Product Management, Marketing, Sales, Information Technology (IT), Computer Science, Project Management, Sales Skills"
926,Senior Product Manager - Jumia (Full Time),Jumia Group,Egypt,Cairo,Full Time,Not Specified,Experienced,Not Specified,"IT/Software Development, Marketing/PR/Advertising, Sales/Retail, Sales, Marketing, Information Technology (IT), Sales Skills, Project Management, Product Management, Computer Science"
927,Senior Business Analyst,InfoVision Inc.,UnitedArabEmirates,Dubai,Full Time,Not Specified,Experienced,Not Specified,"IT/Software Development, Analyst/Research, Engineering - Telecom/Technology, Information Technology (IT), Business Analysis, Computer Science, Analysis, Business Development, Sales, Sales Skills"
928,Technical Sales Engineer,Belimo,UnitedArabEmirates,Dubai,Full Time,Not Specified,Entry Level,Not Specified,"Engineering - Construction/Civil/Architecture, Sales/Retail, Engineering - Mechanical/Electrical, Engineering, Sales, Sales Skills, Sales Target, Electrical Engineering, Mechanical Engineering, AutoCAD"
929,"Sales Representative, Equipment Trading",Saudi Diesel Equipment Company,SaudiArabia,Riyadh,Full Time,Not Specified,Entry Level,Not Specified,"Customer Service/Support, Medical/Healthcare, Sales/Retail, Medical, Sales, Sales Skills, Sales Target, Customer Care, Customer Service, Customer Support"
930,Senior Java Developer,Flow Talent,Egypt,Cairo,Full Time,Not Specified,Experienced,Not Specified,"Business Development, IT/Software Development, Engineering - Telecom/Technology, Information Technology (IT), Computer Science, Software Development, javaScript, Software Engineering, CSS, SQL"
931,Business Development Manager - Africa and UAE - Cirium,LexisNexis Risk Solutions,UnitedArabEmirates,Dubai,Full Time,Not Specified,Experienced,Not Specified,"Business Development, Marketing/PR/Advertising, Sales/Retail, Business Development, Sales, Sales Skills, Sales Target, Marketing, Customer Service, Customer Support"
932,Enterprise Network Engineer ( Remote),ServerHub,Egypt,Cairo,Full Time,Not Specified,Experienced,Not Specified,"Installation/Maintenance/Repair, IT/Software Development, Engineering - Telecom/Technology, Information Technology (IT), Computer Science, Engineering, Networking, CCNA, CCNP, Networks"
933,Business Analyst,Truelancer.com,UnitedArabEmirates,Dubai,Full Time,Not Specified,Entry Level,Not Specified,"IT/Software Development, Analyst/Research, Engineering - Telecom/Technology, Business Analysis, Information Technology (IT), Computer Science, Analysis, Software Development, Software, Computer Engineering"
934,Engineering & Integrity General Manager,Dragon Oil,Egypt,Cairo,Full Time,Not Specified,Not specified,Not Specified,"IT/Software Development, Engineering - Telecom/Technology, Engineering - Mechanical/Electrical, Engineering, Information Technology (IT), Computer Science, Software Development, Software Engineering, Computer Engineering, Mechanical Engineering"
935,Systems Integration Lead,Honeywell,Egypt,Cairo,Full Time,Not Specified,Experienced,Not Specified,"IT/Software Development, Project/Program Management, Engineering - Telecom/Technology, Computer Science, Information Technology (IT), Computer Engineering, Integration, Software Development, XML, Engineering"
936,Associate - External Audit (UAE Nationals),Grant Thornton,UnitedArabEmirates,Dubai,Full Time,Not Specified,Entry Level,Not Specified,"Business Development, Customer Service/Support, Sales/Retail, Sales Skills, Customer Service, Sales Target, Sales, Marketing, Outdoor Sales, Business Development"
937,IT Performance Director,Core42,UnitedArabEmirates,Dubai,Full Time,Not Specified,Manager,Not Specified,"IT/Software Development, Operations/Management, Engineering - Telecom/Technology, Computer Science, Information Technology (IT), ITIL, Operations, Project Management, Engineering, IT Operations"
938,Network Operations Engineer - Egypt,Juniper Networks,Egypt,Cairo,Full Time,Not Specified,Not specified,Not Specified,"Installation/Maintenance/Repair, IT/Software Development, Engineering - Telecom/Technology, Information Technology (IT), Computer Science, Engineering, Networking, CCNA, Networks, CCNP"
939,Product Lifecycle Specialist IMETA,Boehringer Ingelheim,UnitedArabEmirates,Dubai,Full Time,Not Specified,Experienced,Not Specified,"IT/Software Development, Marketing/PR/Advertising, Engineering - Telecom/Technology, information technology (it), computer science, engineering, sales, product, english, analysis"
940,Regional Development Manager,Pearson,UnitedArabEmirates,Dubai,Full Time,Not Specified,Not specified,Not Specified,"Business Development, Marketing/PR/Advertising, Sales/Retail, Sales, Business Development, Sales Skills, Sales Target, Marketing, Management, Customer Service"
941,Database Administrator (DBA),DeepSource,SaudiArabia,Riyadh,Full Time,Not Specified,Not specified,Not Specified,"Installation/Maintenance/Repair, IT/Software Development, Engineering - Telecom/Technology, Information Technology (IT), Computer Science, SQL, Oracle, Database Administration, Database, Linux"
942,Project Manager - Digital Transformation,Saudia Dairy & Foodstuff Co.,SaudiArabia,Jeddah,Full Time,Not Specified,Not specified,Not Specified,"Engineering - Construction/Civil/Architecture, IT/Software Development, Project/Program Management, Project Management, Engineering, Information Technology (IT), Management, Computer Science, Civil Engineering, Microsoft Office"
943,Quality Front Line Assistant Manager,Pepsi,SaudiArabia,Riyadh,Full Time,Not Specified,Not specified,Not Specified,"IT/Software Development, Sales/Retail, Engineering - Telecom/Technology, information technology (it), engineering, computer science, microsoft office, sales, management, english"
944,QA Lead,Morgan Advanced Materials,UnitedArabEmirates,Dubai,Full Time,Not Specified,Experienced,Not Specified,"IT/Software Development, Quality, Engineering - Telecom/Technology, information technology (it), computer science, quality assurance, qa, quality, engineering, qc"
945,Product Lifecycle Specialist META,Boehringer Ingelheim,UnitedArabEmirates,Dubai,Full Time,Not Specified,Experienced,Not Specified,"IT/Software Development, Marketing/PR/Advertising, Engineering - Telecom/Technology, information technology (it), computer science, engineering, marketing, product, english, analysis"
946,Project Manager Sr. Analyst,Pepsi,Egypt,Cairo,Full Time,Not Specified,Not specified,Not Specified,"IT/Software Development, Project/Program Management, Engineering - Telecom/Technology, Project Management, Information Technology (IT), Computer Science, PMP, Software Engineering, Telecommunication, Microsoft Office"
947,Service Sales Support Engineer,Bühler Group,UnitedArabEmirates,Dubai,Full Time,Not Specified,Not specified,Not Specified,"Customer Service/Support, Sales/Retail, Engineering - Mechanical/Electrical, Customer Service, Sales, Customer Support, Customer Care, Sales Skills, Engineering, Sales Target"
948,Backend Engineer,Abgad أبجد,Egypt,Cairo,Full Time,Not Specified,Entry Level,Not Specified,"Creative/Design/Art, IT/Software Development, Engineering - Telecom/Technology, Information Technology (IT), Computer Science, Software Development, Software Engineering, Back-End, Engineering, PHP"
949,Thermal Insulation Specialist - Munitions Development,HALCON,UnitedArabEmirates,Dubai,Full Time,Not Specified,Entry Level,Not Specified,"Installation/Maintenance/Repair, IT/Software Development, Engineering - Telecom/Technology, information technology (it), computer science, engineering, mcse, software, quality assurance, quality control"
950,Senior Specialist - Business Analysis,Core42,UnitedArabEmirates,Dubai,Full Time,Not Specified,Experienced,Not Specified,"Human Resources, Marketing/PR/Advertising, Media/Journalism/Publishing, Marketing, Social Media, Human Resources (HR), E-marketing, Microsoft Office, Digital Marketing, Media"
951,Platform Architect – Conversational Commerce,Coca-Cola HBC,Egypt,Cairo,Full Time,Not Specified,Experienced,Not Specified,"IT/Software Development, Marketing/PR/Advertising, Media/Journalism/Publishing, marketing, social media, media, digital marketing, computer science, english, azure"
952,Full-Stack Web Developer,inoi,UnitedArabEmirates,Dubai,Full Time,Not Specified,Not specified,Not Specified,"Creative/Design/Art, IT/Software Development, Engineering - Telecom/Technology, Information Technology (IT), Computer Science, Software Development, javaScript, HTML, CSS, Full Stack"
953,Cyber Security Engineer,High5,UnitedArabEmirates,Dubai,Full Time,Not Specified,Experienced,Not Specified,"Installation/Maintenance/Repair, IT/Software Development, Engineering - Telecom/Technology, Information Technology (IT), Computer Science, Engineering, Security, Networking, Computer Engineering, Cisco"
954,Backend Engineer,G42 Healthcare,UnitedArabEmirates,Dubai,Full Time,Not Specified,Entry Level,Not Specified,"Creative/Design/Art, IT/Software Development, Engineering - Telecom/Technology, Information Technology (IT), Computer Science, Software Development, Software Engineering, Back-End, Engineering, PHP"
955,Service Program Manager II,Panasonic Avionics Corporation,UnitedArabEmirates,Dubai,Full Time,Not Specified,Experienced,Not Specified,"IT/Software Development, Operations/Management, Project/Program Management, Project Management, Information Technology (IT), Management, Program Management, Computer Science, VxBlock, VxRack"
956,Developers,RedHolt,UnitedArabEmirates,Dubai,Full Time,Not Specified,Experienced,Not Specified,"Business Development, IT/Software Development, Engineering - Telecom/Technology, Information Technology (IT), Computer Science, Software Development, Software Engineering, Business Development, javaScript, Engineering"
957,Chief Architect,M2,UnitedArabEmirates,Dubai,Full Time,Not Specified,Manager,Not Specified,"IT/Software Development, Engineering - Telecom/Technology, Engineering - Mechanical/Electrical, computer science, information technology (it), aws, computer engineering, docker, java, html"
958,Well Testing Engineer Trainee,Rawabi United Safety Services Company Limited (RUSS),SaudiArabia,Riyadh,Full Time,Not Specified,Student,Not Specified,"IT/Software Development, Quality, Engineering - Telecom/Technology, information technology (it), computer science, software development, engineering, testing, communication skills, production"
959,Business Development Manager (Saudization),EuroTech ME,SaudiArabia,Riyadh,Full Time,Not Specified,Experienced,Not Specified,"Business Development, Marketing/PR/Advertising, Sales/Retail, Business Development, Sales, Sales Skills, Sales Target, Marketing, Customer Service, Customer Support"
960,Customer Solutions Specialist,Bosch Middle East,UnitedArabEmirates,Dubai,Full Time,Not Specified,Entry Level,Not Specified,"Customer Service/Support, Logistics/Supply Chain, Sales/Retail, Customer Service, Customer Care, Customer Support, Call Center, Sales, Microsoft Office, Communication Skills"
961,Senior Intergration Engineer,Al Ahly Momkn For E-payments,Egypt,Cairo,Full Time,Not Specified,Experienced,Not Specified,"IT/Software Development, Engineering - Telecom/Technology, Engineering - Mechanical/Electrical, Engineering, Information Technology (IT), Computer Science, Software Engineering, Software Development, Computer Engineering, Mechanical Engineering"
962,Lead Consultant,Gallup,SaudiArabia,Riyadh,Full Time,Not Specified,Entry Level,Not Specified,"IT/Software Development, Sales/Retail, Engineering - Telecom/Technology, Sales, Sales Skills, Real Estate, Sales Target, Lead Generation, Microsoft Office, Information Technology (IT)"
963,Intern Medical Rep - Jeddah,Haleon,SaudiArabia,Makkah,Part Time,Not Specified,Student,Not Specified,"Medical/Healthcare, Sales/Retail, Pharmaceutical, Medical, Sales, Pharmacy, Sales Skills, Sales Target, Science, Veterinary"
964,SR. BUSINESS ANALYST (PROCESS EXCELLENCE),QatarEnergy,Qatar,Doha,Full Time,Not Specified,Experienced,Not Specified,"IT/Software Development, Analyst/Research, Engineering - Telecom/Technology, Business Analysis, Information Technology (IT), Computer Science, Analysis, Software Development, Software, Engineering"
