,job_title,company_name,country,city,job_type,work_location,experience_level,yrs_exp,industry_and_skills
370,Senior Web Developer,Johnson Controls,Egypt,Cairo,Full Time,On-site,Experienced,4 - 6,"IT/Software Development, Computer Science, .Net, MVC, Software Development, Information Technology (IT), Design, UX\UI, HTML, CSS"
371,Senior Java Developer,Egabi FSI,Egypt,Cairo,Full Time,On-site,Experienced,5+,"IT/Software Development, Engineering - Telecom/Technology, Engineering, Git, Information Technology (IT), Java, OOP, Software, Computer Science, Software Engineering"
372,Business Development Representative,Bit68,Egypt,Cairo,Full Time,Hybrid,Entry Level,1 - 3,"Business Development, Marketing/PR/Advertising, Sales/Retail, Business Development, computer, Sales, Software, Communication, Computer Science, sales skills"
373,Senior Frontend Developer - Fully Remote Job,Confidential,Egypt,Cairo,Full Time,Remote,Experienced,3 - 10,"IT/Software Development, Engineering - Telecom/Technology, Engineering - Other, CSS3, Computer Science, Software Development, Software Engineering, front-end, HTML5, Information Technology (IT)"
374,Infrastructure Engineer / VMware,Efada Technology,Egypt,Giza,Full Time,Hybrid,Experienced,3 - 7,"Installation/Maintenance/Repair, IT/Software Development, Engineering - Telecom/Technology, Computer Science, Information technology, Engineering, Technology, Servers, Telecom, Telecommunication"
375,Senior Oracle Apps Developer,EVA Cosmetics ,Egypt,Giza,Full Time,On-site,Experienced,4 - 7,"IT/Software Development, Pharmaceutical, Engineering - Telecom/Technology, Computer Science, PL/SQL, Information Technology (IT), Software Development, Oracle, SQL, business"
376,React Native Developer,mazenet solution ,Egypt,Cairo,Full Time,On-site,Experienced,3 - 5,"IT/Software Development, Engineering - Telecom/Technology, React Native, JavaScript, Typescript, RESTful APIs, Redux, mobx, Mobile Development, Software Development"
377,Full Stack Developer,3S Software,Egypt,Cairo,Full Time,Hybrid,Experienced,2 - 4,"Installation/Maintenance/Repair, IT/Software Development, Engineering - Telecom/Technology, MySQL, MVC, Information Technology (IT), JavaScript, HTML5, HTML, API"
378,ERP Functional Consultant,Ultimate Solutions Egypt,Egypt,Giza,Full Time,On-site,Experienced,1 - 5,"Accounting/Finance, Business Development, IT/Software Development, Accounting, business, Business Processes, Computer Science, ERP, Information Technology (IT), English"
379,ATM/POS Switch Technical Administrator,e-finance,Egypt,Giza,Full Time,On-site,Experienced,1 - 2,"IT/Software Development, ATM, Banking, Computer Science, Configuration, Engineering, Information Technology (IT), IST, Linux, Pos"
380,Project Manager,Confidential,Egypt,Cairo,Full Time,On-site,Senior Management,3 - 7,"Business Development, Project/Program Management, Strategy/Consulting, Project, Planning, Projects, Management, Computer Science, Engineering"
381,Lead Scrum Master/Agile Coach,Giza Systems,Egypt,Cairo,Full Time,On-site,Manager,7 - 20,"IT/Software Development, Agile, Computer Science, Information Technology (IT), Scrum, Scrum Master, Management, Development, Communication"
382,Odoo Implementer,Confidential,Egypt,Giza,Full Time,On-site,Experienced,3+,"Accounting/Finance, IT/Software Development, Engineering - Telecom/Technology, Odoo Implementer, Odoo, Information Technology (IT), ERP, Computer Science"
383,Zoho CRM Implementer,Bevatel,Egypt,Giza,Full Time,On-site,Experienced,2 - 4,"IT/Software Development, CRM, Information Technology (IT), Computer Science, Computer Engineering, CRM Implementer, Zoho CRM, zoho implementation, zoho customization"
384,IT Specialist . Tanta,Ibn Sina Pharma,Egypt,Gharbia,Full Time,On-site,Experienced,1 - 3,"Hospitality/Hotels/Food Services, IT/Software Development, Engineering - Telecom/Technology, CCNA, Computer Science, Information Technology (IT), MCSA, MCITP"
385,IT- ICS/OT Cybersecurity Senior Engineer,Elfaeed Recruitment Agency,SaudiArabia,Riyadh,Full Time,On-site,Experienced,5+,"IT/Software Development, Engineering - Telecom/Technology, IT Service Management, Cybersecurity, Computer Science, Information Technology (IT), Telecommunication"
386,ERP Project Manager,ATRIC Developments,Egypt,Cairo,Full Time,On-site,Experienced,6 - 8,"IT/Software Development, Project/Program Management, Development, Information Technology (IT), Odoo Development, Odoo, Project Management, Computer Science, Software, ERP System"
387,IDB3325 - Data Visualization &Analytics Specialist,Islamic Development Bank (IsDB),SaudiArabia,Makkah,Full Time,Not Specified,Entry Level,Not Specified,"Accounting/Finance, Operations/Management, Quality, audit, audits, analytics, sap, managementdevelop"
388,Senior Frontend Developer,Tenjaz,Egypt,Cairo,Full Time,On-site,Experienced,2 - 5,"IT/Software Development, Engineering - Telecom/Technology, React.js, React, Software Development, Information Technology (IT), Software Engineering, Vue, Computer Engineering, Computer Science"
389,Senior Quality Assurance Analyst,Tangent,Egypt,Cairo,Full Time,Hybrid,Experienced,4 - 10,"IT/Software Development, Quality, Information Technology (IT), English, QA, quality, Quality Assurance, Testing, Agile, APIs"
390,Supervisor Curriculum Specialist Health Sciences,Institute of Applied Technology,UnitedArabEmirates,Dubai,Full Time,Not Specified,Experienced,Not Specified,"R&D/Science, Quality, Pharmaceutical, science, pharmacy, medical, pharmaceutical, engineering, education, teaching"
391,Senior Elixir Developer,FlairsTech,Egypt,Cairo,Full Time,Hybrid,Experienced,4 - 5,"IT/Software Development, Engineering - Telecom/Technology, Elixir, Phoneix, OTP, Programming, Development, Information Technology (IT), Software Engineering, Software Development"
392,Oracle Developer,National Paints,Egypt,Cairo,Full Time,On-site,Experienced,1 - 6,"Installation/Maintenance/Repair, IT/Software Development, Engineering - Telecom/Technology, computer, Computer Science, Information Technology (IT), ITIL, MIS, OCP, Oracle"
393,Network Security Administrator,Exception Patisserie,Egypt,Giza,Full Time,On-site,Experienced,4 - 7,"males_only, IT/Software Development, Engineering - Telecom/Technology, Engineering, ESXi, firewalls, HW, Information Technology (IT), Installation, Network Administration, server"
394,IT Manager,Naguib Selim,Egypt,Cairo,Full Time,On-site,Manager,5 - 10,"Installation/Maintenance/Repair, IT/Software Development, Information Technology (IT), Computer Science, Computer Engineering, Project Management, IT Manager"
395,Application Support Team Leader,Confidential,Egypt,Cairo,Full Time,On-site,Experienced,5 - 7,"Customer Service/Support, IT/Software Development, Engineering - Mechanical/Electrical, Engineering, JavaScript, Software Development, Computer Science, Agile, Communication skills, Software Engineering"
396,Senior Dynamics 365 Finance & Operations Retail Developer,Confidential,Egypt,Cairo,Full Time,On-site,Senior Management,4 - 6,"Accounting/Finance, IT/Software Development, Operations/Management, Microsoft Dynamics, Microsoft dynamics 365, Retail, Dynamics, Dynamics 365, Software Development, Web Development"
397,Senior Backend Developer PHP / Laravel,Sulfah,Egypt,Cairo,Full Time,On-site,Experienced,3 - 7,"IT/Software Development, Engineering - Telecom/Technology, Computer Engineering, Computer Science, Information Technology (IT), PHP, Software Development, Software"
398,ERP Specialist Dynamic 365,Exception Patisserie,Egypt,Giza,Full Time,On-site,Experienced,3 - 8,"males_only, Installation/Maintenance/Repair, IT/Software Development, Engineering - Telecom/Technology, Dynamic 365, ERP, Computer Science, Information Technology (IT), Microsoft dynamics 365"
399,Technical Prodcut Owner,NOK for Human Capital Solutions,Egypt,Cairo,Full Time,Hybrid,Experienced,4 - 6,"IT/Software Development, Information Technology (IT), Java, Computer Science, Software Development, Python, c++, Networking"
400,Senior System & Network Admin,Cashcall,Egypt,Cairo,Full Time,Hybrid,Experienced,3+,"Installation/Maintenance/Repair, IT/Software Development, Engineering - Telecom/Technology, Computer Science, IT, Networking, Information Technology (IT), System Administration, Maintenance, Python"
401,Senior AI Engineer,Lumin,Egypt,Giza,Full Time,Hybrid,Experienced,3 - 5,"IT/Software Development, AI, Artificial Intelligence, Computer Vision, Machine Learning, TensorFlow, Python, Computer Science, Programming, PyTorch"
402,IT Help Desk Specialist,R squared Holding,Egypt,Cairo,Full Time,On-site,Experienced,5 - 7,"IT/Software Development, Engineering - Telecom/Technology, Information Technology (IT), Help desk, Databases, Troubleshooting, Computer Science, Odoo Development"
403,Business Analyst,IT Pillars,Egypt,Cairo,Full Time,On-site,Experienced,2 - 4,"IT/Software Development, Analyst/Research, Engineering - Telecom/Technology, business, Business Analysis, Analysis, Communication skills, Computer Science, Development, Software Development"
404,Senior Application Support,Shifa Egypt,Egypt,Cairo,Full Time,On-site,Experienced,3 - 5,"Administration, IT/Software Development, Analysis, application, Application Support, computer, Computer Science, Customer Service, Information Systems, Information Technology (IT)"
405,Senior Django Developer,Confidential,Egypt,Cairo,Full Time,Hybrid,Experienced,3 - 6,"IT/Software Development, Django, Django Framework, Software Development, Front-End Development, front-end web development, Back-End Development, Development, Computer Science, Software Engineering"
406,Senior Mobile Developer,Cashcall,Egypt,Cairo,Full Time,Hybrid,Experienced,3+,"R&D/Science, IT/Software Development, Agile Software, Computer Science, Android, Engineering, Information Technology (IT), Software Development, Software Engineering, Software"
407,Software Technical Lead,HMASERV LLC,Egypt,Alexandria,Full Time,Hybrid,Manager,5+,"IT/Software Development, PHP, JavaScript, Kotlin, Android, Software Architecture, Information Technology (IT), Software, Computer Science, Programming"
408,"ERP Project Lead & Support "" Implementer """,T&D Design,Egypt,Cairo,Full Time,On-site,Experienced,5 - 7,"IT/Software Development, Project/Program Management, Engineering - Telecom/Technology, Technical Support, ERP, ERP Implementation, Microsoft SQL Server 2012, Odoo ERP, Computer Science, Odoo"
409,IT Director,Confidential,Egypt,Monufya,Full Time,On-site,Senior Management,15+,"Creative/Design/Art, IT/Software Development, Engineering - Telecom/Technology, Information Technology (IT), IT Infrastructure, Project Management, computer, Computer Science, Engineering, IT"
410,Product Owner,NOK for Human Capital Solutions,Egypt,Cairo,Full Time,On-site,Experienced,2 - 5,"IT/Software Development, Project/Program Management, Engineering - Telecom/Technology, Computer Science, Development, Agile, Information Technology (IT), Project, Java, Software Development"
411,VIE/Pangeo Data Governance Specialist M/W,VEOLIA,UnitedArabEmirates,Dubai,Full Time,Not Specified,Not specified,Not Specified,"Analyst/Research, Sales/Retail, analysis, indoor sales, outdoor sales, sales"
412,Quality Assurance Specialist,Ecomaster,Egypt,Giza,Full Time,On-site,Entry Level,1 - 3,"Business Development, Operations/Management, Quality, QA, quality, Quality Assurance, Science"
413,Senior Backend Developer,Travolic.LLc,Egypt,Cairo,Full Time,Hybrid,Experienced,3 - 5,"Creative/Design/Art, IT/Software Development, Engineering - Telecom/Technology, API, Computer Science, JavaScript, Express.js, NestJS., Node.js, RESTful APIs"
414,"Senior Automation Quality Engineer (Selenium, Appium, REST Assured)",Money Loop ,Egypt,Cairo,Full Time,Hybrid,Experienced,5 - 8,"IT/Software Development, Quality, Engineering - Telecom/Technology, Automation, Automation Testing, Computer Science, Selenium, QA, quality, Quality Control"
415,Odoo Developer / Implementer,SERA Mattress & Furniture ,Egypt,Cairo,Full Time,On-site,Entry Level,1 - 3,"Installation/Maintenance/Repair, IT/Software Development, Engineering - Telecom/Technology, Odoo, Programming, JavaScript, MVC, HTML, XML, Software Development"
416,Software Tester,qTech. ,Egypt,Dakahlia,Full Time,On-site,Entry Level,1+,"IT/Software Development, Quality, Engineering - Telecom/Technology, Quality Assurance, Quality Control, Engineering, Quality, SQL, Zephyr, Testing"
417,Quality Control Lab Chemist,KALINE COSMETICS ,Egypt,Giza,Full Time,On-site,Experienced,1 - 3,"R&D/Science, Quality, Chemistry, Laboratory, QC, Quality Control, Research, Science, English"
418,Full Stack .Net Developer,Confidential,Egypt,Cairo,Full Time,Remote,Experienced,4 - 10,"IT/Software Development, Engineering - Telecom/Technology, .Net, Angular, Full Stack, SQL, ASP.net MVC, ASP.Net Web API, Full Stack Development, Visual Studio .net"
419,System Administrator,Dough and More Food Industries,Egypt,Giza,Full Time,On-site,Experienced,3 - 6,"males_only, IT/Software Development, Engineering - Telecom/Technology, Administration, IT, Microsoft Windows, Network Administration, Engineering, Computer Science, System Administration"
420,Odoo Developer,GMC,Egypt,Cairo,Full Time,On-site,Experienced,2 - 5,"Installation/Maintenance/Repair, IT/Software Development, Engineering - Telecom/Technology, Android, Computer Science, Development, Engineering, Information Technology (IT), Mobile Development, Odoo"
421,Backend Developer (Laravel),Bright Creations,Egypt,Giza,Full Time,Hybrid,Entry Level,2+,"IT/Software Development, Engineering - Telecom/Technology, Engineering, APIs, Laravel, PHP, Back-End Development, Full Stack Development, Computer Science, Information Technology (IT)"
422,Network Technical Support,IT Pillars,Egypt,Cairo,Full Time,On-site,Experienced,2 - 4,"Installation/Maintenance/Repair, IT/Software Development, Engineering - Telecom/Technology, Information Technology (IT), Software Development, Technical Support, IT Support, Networks, Customer Service, Customer Care"
423,DAZU Pay - Python Developer (FinTech),Bright Creations,Egypt,Giza,Full Time,Hybrid,Entry Level,2+,"IT/Software Development, Engineering - Telecom/Technology, Python, Django, Flask, Python Scripting, Web Scraping, WWeb Scraping, CI, Computer Science"
424,DAZU - ReactJS Frontend Developer,Bright Creations,Egypt,Giza,Full Time,Hybrid,Entry Level,2+,"IT/Software Development, Engineering - Telecom/Technology, Sass, JavaScript, CSS, UI, Frontend, HTML5, Software Development, Vue.js"
425,IT Manager,MAC EGYPT REAL ESTATE CO.,Egypt,Cairo,Full Time,On-site,Manager,10 - 15,"IT/Software Development, Engineering - Telecom/Technology, Information Technology (IT), IT, Computer Science, Computer Engineering"
426,Software QC Lead,Confidential,Egypt,Cairo,Full Time,On-site,Experienced,4 - 5,"IT/Software Development, Quality, Agile, Automation, Computer Science, Quality Assurance, Quality Control, Selenium, Software Development, Software Testing"
427,Backend Engineer (Node.js/Express),Raad Alfaris Information Technology Co,Egypt,Cairo,Full Time,Remote,Experienced,3+,"IT/Software Development, Agile, Information Technology (IT), Software Development, Software Engineering, Node.js, Express.js, APIs, Computer Science, Software"
428,Junior PHP Developer,Confidential,Egypt,Alexandria,Full Time,On-site,Entry Level,1 - 4,"IT/Software Development, Engineering - Telecom/Technology, MySQL, Computer Science, Docker, Laravel Framework, Laravel, Nginx, Elasticsearch, Logstash"
429,IT System Administrator,Selah ElTelmeez For Publishing & printing,Egypt,Cairo,Full Time,On-site,Experienced,3 - 5,"Installation/Maintenance/Repair, IT/Software Development, Engineering - Telecom/Technology, MCSA, CCNA, Communication, Computer Science, Engineering, Information Technology (IT), System Administration"
430,IT Remote Support ( Port said ),Elaraby Group,Egypt,PortSaid,Full Time,On-site,Experienced,1 - 2,"IT/Software Development, Other, Engineering - Telecom/Technology, Information Technology (IT), Technical Support, Support, Information Systems, Computer Science"
431,IT Remote Support,Elaraby Group,Egypt,Cairo,Full Time,On-site,Experienced,1 - 2,"IT/Software Development, Other, Engineering - Other, Information Technology (IT), Technical Support, Support, Information Systems, Computer Science"
432,Senior Backend Developer (Laravel and Symfony),TechJump,Egypt,Alexandria,Full Time,Hybrid,Experienced,2 - 6,"IT/Software Development, Engineering - Telecom/Technology, Computer Science, developer, Full Stack Developer, Full Stack"
433,Senior Oracle ADF devloper,Informatique Education,Egypt,Cairo,Full Time,On-site,Experienced,3 - 5,"IT/Software Development, Operations/Management, Engineering - Telecom/Technology, ADF, Computer Science, Design, Information Technology (IT), Testing, Oracle, JSF"
434,Senior Network Administrator,Bayt El Khebra,Egypt,Cairo,Full Time,On-site,Experienced,5 - 10,"males_only, IT/Software Development, Engineering - Telecom/Technology, CCNA, Cisco, CCNP, Communication skills, Information Technology (IT), Security, Software, English"
435,Product Specialist - ( Nasr City - New Cairo),PRT Scientific Office,Egypt,Cairo,Full Time,On-site,Entry Level,0 - 5,"Medical/Healthcare, Sales/Retail, Pharmaceutical, Pharmacy, Veterinary, Medicine, Sales, Customer Service, Pharmaceutical, Cosmetics"
436,PHP Developer,Dimofinf Operations Center,Egypt,Cairo,Full Time,Hybrid,Experienced,4 - 6,"IT/Software Development, Engineering - Telecom/Technology, API, Computer Science, Engineering, PHP, MySQL, Software Development, Laravel, RESTful APIs"
437,PHP Developer,Softxpert Incorporation ,Egypt,Alexandria,Full Time,Hybrid,Experienced,1 - 3,"IT/Software Development, Computer Science, Engineering, Information Technology (IT), Laravel, Software, Software Development, Software Engineering, PHP"
438,PHP Software Developer with Symfony and Laravel Expertise,Charisma Design,Egypt,Cairo,Full Time,On-site,Experienced,3 - 5,"IT/Software Development, Engineering - Telecom/Technology, Agile, Computer Science, API, Information Technology (IT), PHP, Laravel, Software Development"
439,QA Documentation Officer,APEX Pharma,Egypt,Cairo,Full Time,On-site,Experienced,3 - 5,"Quality, Pharmaceutical, QA, GMP, quality, Quality Assurance, GDP, Pharmacy, Science"
440,Communication Engineer,Talaat Moustafa Group,Egypt,Cairo,Full Time,On-site,Entry Level,1 - 3,"IT/Software Development, Engineering - Telecom/Technology, Information Technology (IT), Computer Science, Real Estate, Microsoft Office, Communication Engineering, Computer Engineering, Real-Estate, Troubleshooting"
441,Senior Software QC Engineer (Automation - Performance),quTIP,Egypt,Cairo,Full Time,On-site,Experienced,3 - 8,"IT/Software Development, Microsoft stack, Computer Science, Business Intelligence, BI"
442,IT Manager,El Teriak Industrial Group,Egypt,Giza,Full Time,On-site,Manager,10+,"IT/Software Development, Engineering - Telecom/Technology, Engineering - Mechanical/Electrical, Information Technology (IT), Computer Science, Engineering, Telecommunication, Information Systems, IT Operations, Systems Administration"
443,Quality Assurance Engineer,Confidential,Egypt,Giza,Full Time,Remote,Entry Level,1+,"IT/Software Development, Engineering - Telecom/Technology, Quality Assurance, Software, Testing, Computer Engineering, Computer Science, ISTQB, QA, SQL"
444,Junior IT Technician,Mico World Limited,Egypt,Cairo,Full Time,On-site,Entry Level,1+,"males_only, Installation/Maintenance/Repair, IT/Software Development, Engineering - Telecom/Technology, English, Hardware, Computer Science, Information Technology (IT), Software Development, Software, Software Engineering"
445,Senior .NET Backend Software Engineer - On-site,Microwize,Egypt,Cairo,Full Time,On-site,Experienced,5 - 10,"IT/Software Development, Engineering - Telecom/Technology, Communication skills, Computer Science, Information Technology (IT), Software Development, IT, Team Player, backend, English"
446,Technical Support Engineer,Confidential,Egypt,Cairo,Full Time,On-site,Experienced,1 - 1,"IT/Software Development, CCNA, MCSA, Communication skills, Computer Science, IT, Technical Support"
447,Filling & Packaging Specialist,EVA Cosmetics ,Egypt,Giza,Full Time,On-site,Entry Level,1 - 3,"Logistics/Supply Chain, Manufacturing/Production, Purchasing/Procurement, Packaging, Science, Cosmetics, Architecture, Manufacturing, Pharmaceutical Industry, Pharmacy"
448,Engineer (Maintenance) /Maintenance Technician- Mobile (Hegaz & Maadi),Raya Distribution,Egypt,Cairo,Full Time,On-site,Experienced,0 - 2,"Customer Service/Support, Sales/Retail, Engineering - Telecom/Technology, Computer Science, Engineering, Communication, quality, Repair, technical"
449,Senior Systems administrator,Nile University,Egypt,Giza,Full Time,On-site,Experienced,7 - 10,"IT/Software Development, Engineering - Telecom/Technology, Computer Science, Information Technology (IT), Engineering, System Administration, Network Administration, CCNA, English, Microsoft Office"
450,Sales Specialist,Horizon Chemical for Special Chemicals ,Egypt,Alexandria,Full Time,On-site,Entry Level,0 - 2,"Customer Service/Support, Marketing/PR/Advertising, Sales/Retail, sales skills, Chemicals, Chemistry, Communication, Customer Service, Engineering, Negotiation"
451,QC Lab Chemist,Confidential,Egypt,Giza,Full Time,On-site,Experienced,1 - 3,"males_only, Quality, Science, QC, Chemistry, Quality Control"
452,Product Owner,Bydotpy,Egypt,Cairo,Full Time,On-site,Experienced,3+,"IT/Software Development, Agile, Computer Science, Information Technology (IT), Product Owner, Software, Software Development"
453,Odoo Functional Consultant,Boutiqaat,Egypt,Cairo,Full Time,On-site,Experienced,3 - 7,"Accounting/Finance, IT/Software Development, Engineering - Telecom/Technology, Analysis, business, Business Analysis, ERP, Functional, Information Technology (IT), Odoo"
454,Senior Python Developer (Django - PHP),Confidential,Egypt,Giza,Full Time,Hybrid,Experienced,5+,"IT/Software Development, Engineering - Telecom/Technology, Python, Computer Science, Django, PHP, REST, Information Technology (IT), Software Development, English"
455,Application Support Engineer,LinkIT,Egypt,Damietta,Full Time,On-site,Experienced,1 - 3,"Installation/Maintenance/Repair, IT/Software Development, Engineering - Telecom/Technology, ERP, Software House, Software Pre-Sales, English, Software, Computer Science, Information Technology (IT)"
456,Senior .NET Backend Developer,Kick Start Interactive,Egypt,Giza,Full Time,Hybrid,Experienced,4+,"IT/Software Development, Engineering - Telecom/Technology, .Net, Agile, Computer Science, Git, Microsoft SQL Server, Information Technology (IT), SQL, C#"
457,Junior Product Manager,Seoudi Supermarket,Egypt,Giza,Full Time,Hybrid,Entry Level,1 - 2,"IT/Software Development, Agile, business, Commerce, Computer Science, Engineering, Information Technology (IT), Marketing, Product, Management"
458,PHP Backend Developer,Kick Start Interactive,Egypt,Giza,Full Time,Hybrid,Experienced,2 - 4,"IT/Software Development, Engineering - Telecom/Technology, PHP, Laravel Framework, MVC Architecture, RESTful APIs, Unix/Linux, Information Technology (IT), Laravel, Linux"
459,IT Supervisor,dynamics,Egypt,Cairo,Full Time,On-site,Manager,3 - 5,"IT/Software Development, Engineering - Telecom/Technology, Mac OS, CCNA, CCNP, Maintenance, Computer Engineering, Computer Science, MCSA"
460,IT Specialist,Confidential,Egypt,Sharqia,Full Time,On-site,Experienced,3 - 5,"males_only, Installation/Maintenance/Repair, IT/Software Development, Engineering - Telecom/Technology, Installation, Microsoft Office, IT, Information Technology (IT), Computer Science, Hardware, Software"
461,Junior AI,Nahdet Misr Publishing Group,Egypt,Giza,Full Time,On-site,Experienced,0 - 2,"IT/Software Development, Analyst/Research, Machine Learning, Computer Science, Market Research, Development, AI"
462,ERP System Analyst,Xceed Contact Center,Egypt,Cairo,Full Time,On-site,Entry Level,0 - 1,"IT/Software Development, Engineering - Telecom/Technology, Engineering - Other, Engineering, Oracle, Programming, Software Development, Software, ERP, Computer Science"
463,Laravel Developer,Kyan Labs,Egypt,Cairo,Full Time,On-site,Entry Level,1 - 3,"IT/Software Development, Engineering - Telecom/Technology, Laravel, API, PHP, Information Technology (IT), Software Engineering, HTML, CSS, JavaScript"
464,Senior Testing Engineer,Amasi,Egypt,Cairo,Full Time,Remote,Experienced,5 - 7,"IT/Software Development, Engineering - Telecom/Technology, Computer Science, computer, ISTQB, Software Testing, Testing"
465,Raw Material R&D Specialist,Al-Amal Al-sharif For Plastic,Egypt,Cairo,Full Time,On-site,Experienced,2 - 4,"R&D/Science, Analyst/Research, Pharmaceutical, Analysis, Development, Pharmacy, Plastic, quality, R&amp;D, raw material"
466,PHP Developer,Options,Egypt,Cairo,Full Time,Remote,Experienced,3 - 8,"IT/Software Development, Computer Science, Development, PHP Development, PHP, Software Development, Microsoft Office, AWS, Back-End Development"
467,Product Manager,HIZAM ,Egypt,Cairo,Full Time,Hybrid,Experienced,4 - 8,"IT/Software Development, Agile, Product, Computer Science, Information Technology (IT), Software, Software Development, Product Management, Engineering"
468,IT Help Desk Specialist - HQ,Ceramica Cleopatra ,Egypt,Giza,Full Time,On-site,Entry Level,1 - 3,"Installation/Maintenance/Repair, IT/Software Development, Engineering - Telecom/Technology, Technical Support, MSCE, Technical Reporting, Information Technology (IT), Computer Science, Computer Engineering, Help Desk"
469,Sr. Microsoft Dynamics CRM Developer,Fawry for Banking Technology and Electronic Payments S.A.E,Egypt,Giza,Full Time,On-site,Experienced,3 - 5,"Business Development, IT/Software Development, Engineering - Telecom/Technology, CRM, Engineering, Computer Science, Computer Engineering, Information Technology (IT), Software Development, .Net"
